{
  "$schema": "./schema/release-acceptance-standards.schema.json",
  "version": "v0.0.1:registry:release-acceptance-standards-2",
  "functionalCompleteness": {
    "claim": "functional-complete",
    "requiredForRelease": true,
    "command": "npm run verify:acceptance",
    "covers": [
      "source-organization",
      "static-contracts",
      "unit-and-integration-behavior",
      "development-environment-simulation",
      "failure-injection",
      "repeatability",
      "clean-package-consumer-installability",
      "privacy-safe-evidence"
    ]
  },
  "npmPackageInstallability": {
    "claim": "npm-package-installability-passed",
    "requiredForRelease": true,
    "requiresClaim": "functional-complete",
    "command": "npm run verify:npm-package-installability",
    "controller": "tools/server-scripts/verify-npm-package-installability.ts",
    "receipt": "build/reports/npm-package-installability.json",
    "schemaVersion": "v0.0.1:release:npm-package-installability-report-1"
  },
  "realMachineVerification": {
    "claim": "real-machine-verified",
    "requiredForRelease": false,
    "requiresClaim": "functional-complete",
    "command": "npm run verify:real-machine",
    "targets": [
      {
        "id": "native-linux-x64",
        "system": "linux-x64",
        "environment": "native-host",
        "mode": "optional",
        "simulationCommand": "npm run verify:single-node:ubuntu-container"
      },
      {
        "id": "native-linux-arm64",
        "system": "linux-arm64",
        "environment": "native-host",
        "mode": "optional",
        "simulationCommand": "npm run verify:single-node:ubuntu-container"
      },
      {
        "id": "native-macos-arm64",
        "system": "macos-arm64",
        "environment": "native-host",
        "mode": "optional",
        "simulationCommand": "npm run verify:mcp-release-portable-assembly"
      },
      {
        "id": "native-windows-x64",
        "system": "windows-x64",
        "environment": "native-host",
        "mode": "optional",
        "simulationCommand": "npm run verify:mcp-release-portable-assembly"
      },
      {
        "id": "public-cloud-single-node",
        "system": "declared-linux",
        "environment": "public-cloud",
        "mode": "optional",
        "simulationCommand": "npm run verify:single-node:ubuntu-container"
      },
      {
        "id": "clean-host-recovery",
        "system": "declared-linux",
        "environment": "independent-recovery-host",
        "mode": "optional",
        "simulationCommand": "node tools/server-scripts/verify-storage-production-restore-drill.ts"
      }
    ]
  },
  "releaseDeploymentVerification": {
    "claim": "release-deployment-verified",
    "requiredForRelease": false,
    "requiresClaim": "functional-complete",
    "command": "npm run server:verify:release-deployment",
    "controller": "tools/server-scripts/verify-release-deployment.ts",
    "receipt": "build/reports/release-deployment.json",
    "scenarios": [
      "success",
      "concurrency",
      "cancellation",
      "provider-fault"
    ]
  }
}
